{
  "schema_version": 3,
  "policy": "compact",
  "slots": [
    {
      "slot": 1,
      "label": "Hilbert commissioning pen 1"
    },
    {
      "slot": 2,
      "label": "Hilbert commissioning pen 2"
    },
    {
      "slot": 3,
      "label": "Hilbert commissioning pen 3"
    }
  ],
  "notes": "Known-good three-pen DPX-3300 commissioning plan; physically verify actual loaded tools before confirmation."
}
