{
  "schema_version": 3,
  "policy": "explicit",
  "slots": [
    {
      "slot": 8,
      "label": "tool A",
      "tool": "technical pen",
      "color": "black"
    },
    {
      "slot": 6,
      "label": "tool B",
      "tool": "technical pen",
      "color": "red"
    },
    {
      "slot": 4,
      "label": "tool C",
      "tool": "technical pen",
      "color": "blue"
    },
    {
      "slot": 2,
      "label": "tool D",
      "tool": "technical pen",
      "color": "green"
    },
    {
      "slot": 1,
      "label": "tool E",
      "tool": "technical pen",
      "color": "violet"
    }
  ],
  "notes": "Example only: explicit mappings are useful when preferred tools are already loaded in specific slots.",
  "passes": [
    {
      "id": "plot",
      "assignments": [
        {
          "layer_ids": [
            "pen-2"
          ],
          "physical_slot": 8
        },
        {
          "layer_ids": [
            "pen-3"
          ],
          "physical_slot": 6
        },
        {
          "layer_ids": [
            "pen-4"
          ],
          "physical_slot": 4
        },
        {
          "layer_ids": [
            "pen-5"
          ],
          "physical_slot": 2
        },
        {
          "layer_ids": [
            "pen-6"
          ],
          "physical_slot": 1
        }
      ]
    }
  ]
}
